{
  "$schema": "https://json-schema.org/draft/2020-12/schema",
  "$id": "https://example.com/schemas/mealplan.json",
  "title": "Meal Plan",
  "description": "A weekly meal plan with daily meals, a shopping list, and waste-reduction notes.",
  "type": "object",
  "additionalProperties": false,
  "required": [
    "plan_name",
    "week_start",
    "people",
    "assumptions",
    "days",
    "weekly_preparations",
    "pantry_inventory",
    "shopping_list",
    "estimated_total_cost",
    "waste_reduction_summary"
  ],
  "properties": {
    "plan_name": { "type": "string", "minLength": 1 },
    "week_start": { "type": "string", "format": "date" },
    "people": { "type": "integer", "minimum": 1 },
    "assumptions": {
      "type": "array",
      "items": { "type": "string", "minLength": 1 }
    },
    "days": {
      "type": "array",
      "minItems": 1,
      "items": { "$ref": "#/$defs/dayPlan" }
    },
    "weekly_preparations": {
      "type": "array",
      "description": "One-off batch preparations made ahead for the week, such as banana bread, sauces, or dressings, that get used across multiple meals.",
      "items": { "$ref": "#/$defs/preparation" }
    },
    "pantry_inventory": {
      "type": "array",
      "description": "Items already on hand before this week's shopping, so the plan and shopping list can account for what doesn't need to be bought.",
      "items": { "$ref": "#/$defs/pantryItem" }
    },
    "shopping_list": {
      "type": "array",
      "items": { "$ref": "#/$defs/shoppingItem" }
    },
    "estimated_total_cost": {
      "type": "number",
      "minimum": 0,
      "description": "Estimated total cost of the shopping list for the week, in the plan's local currency."
    },
    "waste_reduction_summary": {
      "type": "array",
      "items": { "type": "string", "minLength": 1 }
    }
  },
  "$defs": {
    "meal": {
      "type": "object",
      "additionalProperties": false,
      "required": ["meal", "servings", "prep_time_minutes", "cook_time_minutes", "difficulty", "notes"],
      "properties": {
        "meal": { "type": "string", "minLength": 1 },
        "servings": { "type": "integer", "minimum": 1 },
        "prep_time_minutes": { "type": "integer", "minimum": 0 },
        "cook_time_minutes": { "type": "integer", "minimum": 0 },
        "difficulty": {
          "type": "string",
          "enum": ["easy", "medium", "hard"]
        },
        "notes": { "type": "string" }
      }
    },
    "dayPlan": {
      "type": "object",
      "additionalProperties": false,
      "required": ["date", "day", "breakfast", "lunch", "dinner", "snacks"],
      "properties": {
        "date": { "type": "string", "format": "date" },
        "day": {
          "type": "string",
          "enum": ["Monday", "Tuesday", "Wednesday", "Thursday", "Friday", "Saturday", "Sunday"]
        },
        "breakfast": { "$ref": "#/$defs/meal" },
        "lunch": { "$ref": "#/$defs/meal" },
        "dinner": { "$ref": "#/$defs/meal" },
        "snacks": {
          "type": "array",
          "items": { "type": "string", "minLength": 1 }
        }
      }
    },
    "preparation": {
      "type": "object",
      "additionalProperties": false,
      "required": ["name", "prep_day", "yield", "storage", "used_for", "notes"],
      "properties": {
        "name": { "type": "string", "minLength": 1 },
        "prep_day": {
          "type": "string",
          "enum": ["Monday", "Tuesday", "Wednesday", "Thursday", "Friday", "Saturday", "Sunday"]
        },
        "yield": { "type": "string", "minLength": 1 },
        "storage": { "type": "string", "minLength": 1 },
        "used_for": {
          "type": "array",
          "items": { "type": "string", "minLength": 1 }
        },
        "notes": { "type": "string" }
      }
    },
    "pantryItem": {
      "type": "object",
      "additionalProperties": false,
      "required": ["item", "quantity", "use_by_date"],
      "properties": {
        "item": { "type": "string", "minLength": 1 },
        "quantity": { "type": "string", "minLength": 1 },
        "use_by_date": {
          "type": "string",
          "format": "date",
          "description": "Date by which this item should be used, e.g. a best-before or expiry date."
        }
      }
    },
    "shoppingItem": {
      "type": "object",
      "additionalProperties": false,
      "required": ["category", "item", "quantity", "used_for", "notes", "aisle", "estimated_price", "purchased", "perishable"],
      "properties": {
        "category": { "type": "string", "minLength": 1 },
        "item": { "type": "string", "minLength": 1 },
        "quantity": { "type": "string", "minLength": 1 },
        "used_for": {
          "type": "array",
          "items": { "type": "string", "minLength": 1 }
        },
        "notes": { "type": "string" },
		"bulkrecommend": { "type": "string" },
        "aisle": {
          "type": "string",
          "description": "Store section for grouping the list the way a store is laid out, e.g. 'produce', 'dairy', 'pantry', 'frozen'.",
          "minLength": 1
        },
        "estimated_price": {
          "type": "number",
          "minimum": 0,
          "description": "Estimated price for the listed quantity, in the plan's local currency."
        },
        "purchased": {
          "type": "boolean",
          "description": "Whether this item has been checked off as bought."
        },
        "perishable": {
          "type": "boolean",
          "description": "Whether this item spoils quickly and should be bought closer to when it's used."
        }
      }
    }
  }
}
