{
  "plan_name": "Low-Waste Family Meal Plan — 14 September 2026",
  "week_start": "2026-09-14",
  "people": 4,
  "assumptions": [
    "The plan is for four people so it safely covers the stated requirement of feeding three or four.",
    "The week starts on the next Monday after the workbook was reviewed: 14 September 2026.",
    "Prices are GBP estimates based on workbook values where supplied and ordinary UK pack prices otherwise; actual shop prices may vary.",
    "Pantry apples are scheduled immediately because the Pantry tab says to use them within two days of 8 September 2026.",
    "The unopened pantry tin of beans had no use-by information, so 8 September 2027 is recorded as a conservative planning date; check the printed date on the tin.",
    "Salt, pepper, cooking oil and common dried herbs/spices are assumed available; fajita seasoning is listed because it is specifically called out in the workbook.",
    "Breakfasts and lunches use the workbook choices, with dinner leftovers deliberately used for lunches to reduce cooking and waste.",
    "Sunday weekly preparation is intended to happen before or alongside the start of the week; prepared items are stored or frozen as noted."
  ],
  "days": [
    {
      "date": "2026-09-14",
      "day": "Monday",
      "breakfast": {"meal": "Toast with peanut butter and sliced pantry apple", "servings": 4, "prep_time_minutes": 8, "cook_time_minutes": 3, "difficulty": "easy", "notes": "Uses the short-dated pantry apples first. Slice only what is needed and refrigerate any cut apple with a little lemon juice."},
      "lunch": {"meal": "Tin of beans on seeded toast", "servings": 4, "prep_time_minutes": 5, "cook_time_minutes": 8, "difficulty": "easy", "notes": "Uses the pantry tin of beans. One additional tin is bought so four people have a sensible lunch portion."},
      "dinner": {"meal": "Salmon, potato wedges and broccoli", "servings": 4, "prep_time_minutes": 10, "cook_time_minutes": 45, "difficulty": "easy", "notes": "Scheduled first because fresh salmon and broccoli are among the most perishable ingredients. Cook extra potatoes for Tuesday lunch."},
      "snacks": ["Pantry apples", "Yoghurts", "Oat cookies"]
    },
    {
      "date": "2026-09-15",
      "day": "Tuesday",
      "breakfast": {"meal": "Ready Brek with soy milk and banana", "servings": 4, "prep_time_minutes": 5, "cook_time_minutes": 3, "difficulty": "easy", "notes": "Uses ripe bananas early; reserve three very ripe bananas for banana bread."},
      "lunch": {"meal": "Mackerel and vegetable rice with leftover potato wedges", "servings": 4, "prep_time_minutes": 5, "cook_time_minutes": 8, "difficulty": "easy", "notes": "Reheat the cooked wedges until piping hot and use four tins of mackerel for four adult-sized servings."},
      "dinner": {"meal": "Chicken fajita wraps with lettuce, peppers and homemade salsa", "servings": 4, "prep_time_minutes": 20, "cook_time_minutes": 20, "difficulty": "medium", "notes": "Uses delicate lettuce and fresh salsa near the start of the week. Cook two extra chicken portions for Wednesday lunch and keep chilled."},
      "snacks": ["Grapes", "Raisins", "Banana bread"]
    },
    {
      "date": "2026-09-16",
      "day": "Wednesday",
      "breakfast": {"meal": "Pancakes with soy milk and blueberries", "servings": 4, "prep_time_minutes": 10, "cook_time_minutes": 15, "difficulty": "medium", "notes": "Uses blueberries while fresh. Extra pancakes can be frozen between sheets of baking paper."},
      "lunch": {"meal": "Chicken mayo sandwiches with leftover fajita chicken", "servings": 4, "prep_time_minutes": 10, "cook_time_minutes": 0, "difficulty": "easy", "notes": "Turns Tuesday's planned extra chicken into lunch. Keep the chicken refrigerated and use within 24 hours."},
      "dinner": {"meal": "Chicken stir-fry with noodles, peppers, onion and sweetcorn", "servings": 4, "prep_time_minutes": 20, "cook_time_minutes": 15, "difficulty": "medium", "notes": "Finishes the opened pepper pack and onions after fajitas. Frozen sweetcorn avoids opening another short-lived fresh pack."},
      "snacks": ["Blueberries", "Cheddars", "Non-dairy yoghurts"]
    },
    {
      "date": "2026-09-17",
      "day": "Thursday",
      "breakfast": {"meal": "Cereal with soy milk", "servings": 4, "prep_time_minutes": 3, "cook_time_minutes": 0, "difficulty": "easy", "notes": "A quick breakfast; keep cereal sealed so a family-size box lasts beyond this week."},
      "lunch": {"meal": "Ham sandwiches with lettuce", "servings": 4, "prep_time_minutes": 10, "cook_time_minutes": 0, "difficulty": "easy", "notes": "Finishes the fajita lettuce and uses the opened bread before it stales. Freeze spare bread slices if consumption is slower than expected."},
      "dinner": {"meal": "Roast chicken dinner with roast potatoes, carrots and peas", "servings": 6, "prep_time_minutes": 20, "cook_time_minutes": 75, "difficulty": "hard", "notes": "A six-serving roast deliberately creates chicken for Friday lunch. Strip and chill leftovers promptly; freeze the carcass for stock."},
      "snacks": ["Satsumas", "Crisps", "Banana bread"]
    },
    {
      "date": "2026-09-18",
      "day": "Friday",
      "breakfast": {"meal": "Toast with jam", "servings": 4, "prep_time_minutes": 5, "cook_time_minutes": 3, "difficulty": "easy", "notes": "Uses the opened loaf; freeze any remaining slices today for later toast."},
      "lunch": {"meal": "Roast chicken mayo wraps", "servings": 4, "prep_time_minutes": 10, "cook_time_minutes": 0, "difficulty": "easy", "notes": "Uses Thursday's planned roast chicken leftovers and the remaining wraps. Add any sound leftover lettuce or salsa."},
      "dinner": {"meal": "Fish fingers, chips, beans and peas", "servings": 4, "prep_time_minutes": 10, "cook_time_minutes": 25, "difficulty": "easy", "notes": "A freezer-led meal late in the week; frozen components prevent waste. Use one tin of beans and save the other tins for jackets and lunch."},
      "snacks": ["Oat bars", "Yoghurts", "Chocolate"]
    },
    {
      "date": "2026-09-19",
      "day": "Saturday",
      "breakfast": {"meal": "Bacon sandwiches", "servings": 4, "prep_time_minutes": 5, "cook_time_minutes": 12, "difficulty": "easy", "notes": "Uses the opened bread or frozen slices and the full bacon pack in one sitting, avoiding a partial pack."},
      "lunch": {"meal": "Leek and potato soup with bread", "servings": 4, "prep_time_minutes": 15, "cook_time_minutes": 30, "difficulty": "easy", "notes": "Uses remaining potatoes and a whole leek pack. Make six portions and reserve two for Sunday lunch."},
      "dinner": {"meal": "Jacket potatoes with tuna, cheese and beans", "servings": 4, "prep_time_minutes": 10, "cook_time_minutes": 60, "difficulty": "easy", "notes": "Long-keeping potatoes suit the weekend. Put toppings in separate bowls so unused tuna and cheese stay clean and can be chilled."},
      "snacks": ["Biscuits", "Satsumas", "Ice cream"]
    },
    {
      "date": "2026-09-20",
      "day": "Sunday",
      "breakfast": {"meal": "Cereal with soy milk and banana", "servings": 4, "prep_time_minutes": 3, "cook_time_minutes": 0, "difficulty": "easy", "notes": "Finishes opened soy milk and remaining fresh bananas; freeze overripe extras for next week's baking."},
      "lunch": {"meal": "Leftover leek and potato soup with toast", "servings": 4, "prep_time_minutes": 5, "cook_time_minutes": 8, "difficulty": "easy", "notes": "Use Saturday's two reserved portions, extended with toast and fruit; reheat soup until piping hot."},
      "dinner": {"meal": "Spaghetti Bolognese with carrot, celery and onion", "servings": 8, "prep_time_minutes": 20, "cook_time_minutes": 60, "difficulty": "medium", "notes": "Uses the remaining celery and carrots. Make eight portions: eat four and freeze four immediately for a future low-effort dinner."},
      "snacks": ["Oat cookies", "Raisins", "Chocolate"]
    }
  ],
  "weekly_preparations": [
    {"name": "Dairy-free banana bread", "prep_day": "Sunday", "yield": "1 loaf, about 10 slices", "storage": "Keep airtight for 3 days; refrigerate up to 5 days or freeze individual slices for up to 3 months.", "used_for": ["Tuesday snack", "Thursday snack"], "notes": "Make on Sunday when bananas are ripest. Freeze half the loaf at once so it does not stale."},
    {"name": "Fresh tomato salsa", "prep_day": "Sunday", "yield": "About 500 g / 2 cups", "storage": "Refrigerate in a sealed container and use within 3 days.", "used_for": ["Tuesday chicken fajita wraps", "Friday roast chicken mayo wraps"], "notes": "Sunday preparation allows flavours to develop, but keep it chilled. Use any remainder with Friday's wraps rather than opening another sauce."},
    {"name": "Dairy-free oat and raisin cookies", "prep_day": "Sunday", "yield": "About 16 cookies", "storage": "Keep airtight for 5 days or freeze for up to 3 months.", "used_for": ["Monday snack", "Wednesday snack", "Sunday snack"], "notes": "Bake once for several snack slots. Freeze half after cooling to preserve texture and prevent over-consumption or waste."}
  ],
  "pantry_inventory": [
    {"item": "Apples", "quantity": "3", "use_by_date": "2026-09-10"},
    {"item": "Beans", "quantity": "1 tin", "use_by_date": "2027-09-08"}
  ],
  "shopping_list": [
    {"category":"Pantry stock","item":"Apples","quantity":"0 to buy (3 already available)","used_for":["Monday breakfast","Monday snack"],"notes":"Already available in the pantry; use these before buying any more because the Pantry tab says within 2 days.","bulkrecommend":"Do not bulk-buy this week; fresh apples generally keep 1–4 weeks refrigerated, but this stock is already short-dated.","aisle":"produce","estimated_price":0,"purchased":true,"perishable":true},